{
  "protocolVersion": "0.1",
  "admissionRecordId": "urn:missionweaveprotocol:admission-record:crypto-vector-approval",
  "organizationId": "urn:missionweaveprotocol:organization:acme",
  "documentKind": "approval",
  "signingHash": "sha256:495117f78fc1f442b5f02adea515c5a1c17b582296f171de8b5e9dd3f0579285",
  "keyId": "urn:missionweaveprotocol:key:crypto-vector-mission-owner",
  "principal": {
    "type": "human",
    "id": "urn:missionweaveprotocol:human:mission-owner"
  },
  "trustedAcceptedAt": "2026-07-15T04:05:00Z",
  "acceptedBy": {
    "type": "service",
    "id": "urn:missionweaveprotocol:service:admission"
  }
}
