{
  "protocolVersion": "0.1",
  "admissionRecordId": "urn:missionweaveprotocol:admission-record:crypto-vector-event",
  "organizationId": "urn:missionweaveprotocol:organization:acme",
  "documentKind": "event",
  "signingHash": "sha256:b13e0911e40c702f4dfe6f9a23e162ee8d6312c66b712efdbce455762bd7a369",
  "keyId": "urn:missionweaveprotocol:key:crypto-vector-group-authority",
  "principal": {
    "type": "service",
    "id": "urn:missionweaveprotocol:service:group-authority"
  },
  "trustedAcceptedAt": "2026-07-15T03:05:00Z",
  "acceptedBy": {
    "type": "service",
    "id": "urn:missionweaveprotocol:service:admission"
  }
}
