{
  "protocolVersion": "0.1",
  "admissionRecordId": "urn:missionweaveprotocol:admission-record:crypto-vector-extension-profile",
  "organizationId": "urn:missionweaveprotocol:organization:acme",
  "documentKind": "extension-profile",
  "signingHash": "sha256:aa9a0f41efd74f9bad47605f25487025e1d36f117d014c192d9a62645296e8c9",
  "keyId": "urn:missionweaveprotocol:key:crypto-vector-security-owner",
  "principal": {
    "type": "human",
    "id": "urn:missionweaveprotocol:human:security-owner"
  },
  "trustedAcceptedAt": "2026-07-15T06:05:00Z",
  "acceptedBy": {
    "type": "service",
    "id": "urn:missionweaveprotocol:service:admission"
  }
}
