{
  "protocolVersion": "0.1",
  "admissionRecordId": "urn:missionweaveprotocol:admission-record:crypto-vector-agent-card",
  "organizationId": "urn:missionweaveprotocol:organization:acme",
  "documentKind": "agent-card",
  "signingHash": "sha256:5817bf9d0bed81a66be6e92f17b1a72ec23de15e73d130c4b12f6132c3641fc1",
  "keyId": "urn:missionweaveprotocol:key:crypto-vector-organization-registry",
  "principal": {
    "type": "service",
    "id": "urn:missionweaveprotocol:service:organization-registry"
  },
  "trustedAcceptedAt": "2026-07-01T00:05:00Z",
  "acceptedBy": {
    "type": "service",
    "id": "urn:missionweaveprotocol:service:admission"
  }
}
