{
  "protocolVersion": "0.1",
  "admissionRecordId": "urn:missionweaveprotocol:admission-record:crypto-vector-command",
  "organizationId": "urn:missionweaveprotocol:organization:acme",
  "documentKind": "command",
  "signingHash": "sha256:6655c5d67ae3ecc19a4ed04bda7f1372aeaafc7adf939a77715de96ef2100695",
  "keyId": "urn:missionweaveprotocol:key:crypto-vector-rfc8032-1",
  "principal": {
    "type": "agent",
    "id": "urn:missionweaveprotocol:agent:crypto-vector-coordinator"
  },
  "trustedAcceptedAt": "2026-07-15T00:05:00Z",
  "acceptedBy": {
    "type": "service",
    "id": "urn:missionweaveprotocol:service:admission"
  }
}
